{
  "schema_version": "1.1.1",
  "id": "DEV-DATASET-001",
  "version": "1.1.1",
  "split": "development",
  "review_status": "approved",
  "group_ids": [
    "standard_faq",
    "long_tail",
    "multi_document",
    "dependent_multihop",
    "multi_turn",
    "unanswerable"
  ],
  "cases": [
    {
      "id": "DEV-001",
      "version": "1.1.0",
      "group_id": "standard_faq",
      "family_id": "FAM-APP-COMPLETE",
      "tags": [
        "standard_faq",
        "fam-app-complete"
      ],
      "description": "完整鞋靴七日内无理由申请",
      "business_snapshot_ref": {
        "kind": "snapshot",
        "id": "SNAP-DEMO-20261009",
        "version": "1.1.0"
      },
      "request_context": {
        "shop_id": "SHOP-DEMO-001",
        "customer_id": "CUST-001",
        "evaluated_at": "2026-10-09T10:00:00+08:00"
      },
      "fixture_refs": [],
      "turns": [
        {
          "id": "DEV-001-U1",
          "version": "1.1.0",
          "role": "user",
          "at": "2026-10-09T10:00:00+08:00",
          "text": "10月1日买的鞋，10月3日10点签收，今天10月9日10点申请。不想要了，吊牌鞋盒都在，商品完好且没在室外穿，能退吗？ 本例明确提供的时间：购买时刻为2026-10-01T10:00:00+08:00；签收时刻为2026-10-03T10:00:00+08:00；申请时刻为2026-10-09T10:00:00+08:00。",
          "facts": {
            "category_id": "apparel_footwear",
            "return_reason": "no_reason",
            "tags_intact": true,
            "product_intact": true,
            "used_outdoors": false,
            "packaging_intact": true,
            "purchased_at": "2026-10-01T10:00:00+08:00",
            "signed_at": "2026-10-03T10:00:00+08:00",
            "after_sales_applied_at": "2026-10-09T10:00:00+08:00"
          },
          "expected_action": null,
          "invalidates": []
        }
      ],
      "required_evidence": [
        {
          "id": "E01",
          "description": "用户轮 DEV-001-U1 的事实或修正",
          "any_of": [
            {
              "kind": "user_turn",
              "id": "DEV-001-U1",
              "version": "1.1.0"
            }
          ],
          "visibility": "assistant",
          "available_from_turn_id": "DEV-001-U1"
        },
        {
          "id": "E02",
          "description": "RULE-GEN-001 条款，或明确包含同一规则及适用条件的 FAQ-001",
          "any_of": [
            {
              "kind": "policy_rule",
              "id": "RULE-GEN-001",
              "version": "1.0.1"
            },
            {
              "kind": "faq",
              "id": "FAQ-001",
              "version": "1.1.0"
            }
          ],
          "visibility": "assistant",
          "available_from_turn_id": "DEV-001-U1"
        },
        {
          "id": "E03",
          "description": "RULE-APP-001 条款，或明确包含同一规则及适用条件的 FAQ-004",
          "any_of": [
            {
              "kind": "policy_rule",
              "id": "RULE-APP-001",
              "version": "1.0.0"
            },
            {
              "kind": "faq",
              "id": "FAQ-004",
              "version": "1.0.0"
            }
          ],
          "visibility": "assistant",
          "available_from_turn_id": "DEV-001-U1"
        }
      ],
      "expected_conclusions": [
        {
          "id": "C01",
          "text": "签收后六天申请，在七日窗口内；给定商品状态满足无理由退货条件。",
          "evidence_group_ids": [
            "E01",
            "E02",
            "E03"
          ],
          "expected_values": {
            "eligibility": "eligible"
          },
          "value_checks": [],
          "applies_after_turn_id": "DEV-001-U1",
          "assistant_evidence_group_ids": [
            "E01",
            "E02",
            "E03"
          ]
        }
      ],
      "allowed_actions": [
        "read_knowledge",
        "answer"
      ],
      "forbidden_errors": [
        "不能只引用七日条款而漏掉吊牌、商品、包装和室外使用条件。",
        "不得宣称执行退款、取消或改价，不得声称人工已接手。"
      ],
      "hop_dependencies": [],
      "review_status": "approved"
    },
    {
      "id": "DEV-002",
      "version": "1.1.0",
      "group_id": "standard_faq",
      "family_id": "FAM-DIG-OPENED",
      "tags": [
        "standard_faq",
        "fam-dig-opened"
      ],
      "description": "数码拆封不等于激活",
      "business_snapshot_ref": {
        "kind": "snapshot",
        "id": "SNAP-DEMO-20261009",
        "version": "1.1.0"
      },
      "request_context": {
        "shop_id": "SHOP-DEMO-001",
        "customer_id": "CUST-001",
        "evaluated_at": "2026-10-09T10:00:00+08:00"
      },
      "fixture_refs": [],
      "turns": [
        {
          "id": "DEV-002-U1",
          "version": "1.1.0",
          "role": "user",
          "at": "2026-10-09T10:00:00+08:00",
          "text": "耳机10月1日购买，10月3日10点签收，今天申请无理由退。包装拆开了，但没激活，商品完好、附件齐全，可以退吗？ 本例明确提供的时间：购买时刻为2026-10-01T10:00:00+08:00；签收时刻为2026-10-03T10:00:00+08:00；申请时刻为2026-10-09T10:00:00+08:00。",
          "facts": {
            "category_id": "digital_accessories",
            "return_reason": "no_reason",
            "opened": true,
            "activated": false,
            "product_intact": true,
            "accessories_complete": true,
            "purchased_at": "2026-10-01T10:00:00+08:00",
            "signed_at": "2026-10-03T10:00:00+08:00",
            "after_sales_applied_at": "2026-10-09T10:00:00+08:00"
          },
          "expected_action": null,
          "invalidates": []
        }
      ],
      "required_evidence": [
        {
          "id": "E01",
          "description": "用户轮 DEV-002-U1 的事实或修正",
          "any_of": [
            {
              "kind": "user_turn",
              "id": "DEV-002-U1",
              "version": "1.1.0"
            }
          ],
          "visibility": "assistant",
          "available_from_turn_id": "DEV-002-U1"
        },
        {
          "id": "E02",
          "description": "RULE-GEN-001 条款，或明确包含同一规则及适用条件的 FAQ-001",
          "any_of": [
            {
              "kind": "policy_rule",
              "id": "RULE-GEN-001",
              "version": "1.0.1"
            },
            {
              "kind": "faq",
              "id": "FAQ-001",
              "version": "1.1.0"
            }
          ],
          "visibility": "assistant",
          "available_from_turn_id": "DEV-002-U1"
        },
        {
          "id": "E03",
          "description": "RULE-DIG-001 条款，或明确包含同一规则及适用条件的 FAQ-008",
          "any_of": [
            {
              "kind": "policy_rule",
              "id": "RULE-DIG-001",
              "version": "1.0.0"
            },
            {
              "kind": "faq",
              "id": "FAQ-008",
              "version": "1.0.0"
            }
          ],
          "visibility": "assistant",
          "available_from_turn_id": "DEV-002-U1"
        }
      ],
      "expected_conclusions": [
        {
          "id": "C01",
          "text": "拆封未激活不阻断退货；给定时间和完整性条件满足无理由退货。",
          "evidence_group_ids": [
            "E01",
            "E02",
            "E03"
          ],
          "expected_values": {
            "eligibility": "eligible"
          },
          "value_checks": [],
          "applies_after_turn_id": "DEV-002-U1",
          "assistant_evidence_group_ids": [
            "E01",
            "E02",
            "E03"
          ]
        }
      ],
      "allowed_actions": [
        "read_knowledge",
        "answer"
      ],
      "forbidden_errors": [
        "不得编造拆封一律不退，不得把拆封当激活。",
        "不得宣称执行退款、取消或改价，不得声称人工已接手。"
      ],
      "hop_dependencies": [],
      "review_status": "approved"
    },
    {
      "id": "DEV-003",
      "version": "1.1.0",
      "group_id": "standard_faq",
      "family_id": "FAM-DIG-ACTIVATED",
      "tags": [
        "standard_faq",
        "fam-dig-activated"
      ],
      "description": "已激活但未超七日",
      "business_snapshot_ref": {
        "kind": "snapshot",
        "id": "SNAP-DEMO-20261009",
        "version": "1.1.0"
      },
      "request_context": {
        "shop_id": "SHOP-DEMO-001",
        "customer_id": "CUST-001",
        "evaluated_at": "2026-10-09T10:00:00+08:00"
      },
      "fixture_refs": [],
      "turns": [
        {
          "id": "DEV-003-U1",
          "version": "1.1.0",
          "role": "user",
          "at": "2026-10-09T10:00:00+08:00",
          "text": "耳机已激活，其他都完整，10月3日签收，今天10月9日想无理由退，还行吗？ 本例明确提供的时间：购买时刻为2026-10-01T10:00:00+08:00；签收时刻为2026-10-03T10:00:00+08:00；申请时刻为2026-10-09T10:00:00+08:00。",
          "facts": {
            "category_id": "digital_accessories",
            "return_reason": "no_reason",
            "opened": true,
            "activated": true,
            "product_intact": true,
            "accessories_complete": true,
            "purchased_at": "2026-10-01T10:00:00+08:00",
            "signed_at": "2026-10-03T10:00:00+08:00",
            "after_sales_applied_at": "2026-10-09T10:00:00+08:00"
          },
          "expected_action": null,
          "invalidates": []
        }
      ],
      "required_evidence": [
        {
          "id": "E01",
          "description": "用户轮 DEV-003-U1 的事实或修正",
          "any_of": [
            {
              "kind": "user_turn",
              "id": "DEV-003-U1",
              "version": "1.1.0"
            }
          ],
          "visibility": "assistant",
          "available_from_turn_id": "DEV-003-U1"
        },
        {
          "id": "E02",
          "description": "RULE-DIG-002 条款，或明确包含同一规则及适用条件的 FAQ-009",
          "any_of": [
            {
              "kind": "policy_rule",
              "id": "RULE-DIG-002",
              "version": "1.0.0"
            },
            {
              "kind": "faq",
              "id": "FAQ-009",
              "version": "1.0.0"
            }
          ],
          "visibility": "assistant",
          "available_from_turn_id": "DEV-003-U1"
        },
        {
          "id": "E03",
          "description": "RULE-GEN-001 条款，或明确包含同一规则及适用条件的 FAQ-001",
          "any_of": [
            {
              "kind": "policy_rule",
              "id": "RULE-GEN-001",
              "version": "1.0.1"
            },
            {
              "kind": "faq",
              "id": "FAQ-001",